=== START OF INFORMATION SECTION ===
Model Family:     Toshiba 2.5" HDD MQ01ABD...
Device Model:     TOSHIBA MQ01ABD100
Serial Number:    --
LU WWN Device Id: 5 000039 ...
Firmware Version: AX0P3D
User Capacity:    1,000,204,886,016 bytes [1.00 TB]
Sector Sizes:     512 bytes logical, 4096 bytes physical
Rotation Rate:    5400 rpm
Form Factor:      2.5 inches
Device is:        In smartctl database [for details use: -P show]
ATA Version is:   ATA8-ACS (minor revision not indicated)
SATA Version is:  SATA 3.0, 6.0 Gb/s (current: 6.0 Gb/s)
Local Time is:    Fri Jun 22 08:36:03 2018 MSK
SMART support is: Available - device has SMART capability.
SMART support is: Enabled
AAM feature is:   Unavailable
APM level is:     128 (minimum power consumption without standby)
Rd look-ahead is: Enabled
Write cache is:   Enabled
DSN feature is:   Unavailable
ATA Security is:  Disabled, frozen [SEC2]
Wt Cache Reorder: Enabled

=== START OF READ SMART DATA SECTION ===
SMART overall-health self-assessment test result: PASSED

General SMART Values:
Offline data collection status:  (0x80)	Offline data collection activity
					was never started.
					Auto Offline Data Collection: Enabled.
Self-test execution status:      (  25)	The self-test routine was aborted by
					the host.
Total time to complete Offline 
data collection: 		(  120) seconds.
Offline data collection
capabilities: 			 (0x5b) SMART execute Offline immediate.
					Auto Offline data collection on/off support.
					Suspend Offline collection upon new
					command.
					Offline surface scan supported.
					Self-test supported.
					No Conveyance Self-test supported.
					Selective Self-test supported.
SMART capabilities:            (0x0003)	Saves SMART data before entering
					power-saving mode.
					Supports SMART auto save timer.
Error logging capability:        (0x01)	Error logging supported.
					General Purpose Logging supported.
Short self-test routine 
recommended polling time: 	 (   2) minutes.
Extended self-test routine
recommended polling time: 	 ( 236) minutes.
SCT capabilities: 	       (0x003d)	SCT Status supported.
					SCT Error Recovery Control supported.
					SCT Feature Control supported.
					SCT Data Table supported.

SMART Attributes Data Structure revision number: 128
Vendor Specific SMART Attributes with Thresholds:
ID# ATTRIBUTE_NAME          FLAGS    VALUE WORST THRESH FAIL RAW_VALUE
  1 Raw_Read_Error_Rate     PO-R--   100   100   050    -    0
  3 Spin_Up_Time            POS--K   100   100   001    -    1668
  5 Reallocated_Sector_Ct   PO--CK   100   100   050    -    0
  9 Power_On_Hours          -O--CK   092   092   000    -    3434
 12 Power_Cycle_Count       -O--CK   100   100   000    -    2584
191 G-Sense_Error_Rate      -O--CK   100   100   000    -    34
192 Power-Off_Retract_Count -O--CK   100   100   000    -    226
193 Load_Cycle_Count        -O--CK   097   097   000    -    38011
194 Temperature_Celsius     -O---K   100   100   000    -    30 (Min/Max 13/43)
199 UDMA_CRC_Error_Count    -O--CK   200   200   000    -    0
240 Head_Flying_Hours       -O--CK   093   093   000    -    2964
241 Total_LBAs_Written      -O--CK   100   100   000    -    10422561469
242 Total_LBAs_Read         -O--CK   100   100   000    -    6418257543
254 Free_Fall_Sensor        -O--CK   100   100   000    -    0
                            ||||||_ K auto-keep
                            |||||__ C event count
                            ||||___ R error rate
                            |||____ S speed/performance
                            ||_____ O updated online
                            |______ P prefailure warning

General Purpose Log Directory Version 1
SMART           Log Directory Version 1 [multi-sector log support]
Address    Access  R/W   Size  Description
0x00       GPL,SL  R/O      1  Log Directory
0x01           SL  R/O      1  Summary SMART error log
0x02           SL  R/O     51  Comprehensive SMART error log
0x03       GPL     R/O     64  Ext. Comprehensive SMART error log
0x04       GPL,SL  R/O      8  Device Statistics log
0x06           SL  R/O      1  SMART self-test log
0x07       GPL     R/O      1  Extended self-test log
0x09           SL  R/W      1  Selective self-test log
0x10       GPL     R/O      1  NCQ Command Error log
0x11       GPL     R/O      1  SATA Phy Event Counters log
0x80-0x9f  GPL,SL  R/W     16  Host vendor specific log
0xe0       GPL,SL  R/W      1  SCT Command/Status
0xe1       GPL,SL  R/W      1  SCT Data Transfer

SMART Extended Comprehensive Error Log Version: 1 (64 sectors)
No Errors Logged

SMART Extended Self-test Log Version: 1 (1 sectors)
Num  Test_Description    Status                  Remaining  LifeTime(hours)  LBA_of_first_error
# 1  Short offline       Aborted by host               90%      2454         -
# 2  Extended offline    Aborted by host               80%      2354         -
# 3  Short offline       Aborted by host               90%      1889         -
# 4  Short offline       Completed without error       00%      1786         -
# 5  Short offline       Completed without error       00%      1786         -
# 6  Short offline       Completed without error       00%      1674         -
# 7  Short offline       Aborted by host               30%      1674         -
# 8  Short offline       Completed without error       00%      1458         -
# 9  Short offline       Completed without error       00%      1457         -
#10  Short offline       Aborted by host               90%      1457         -
#11  Extended offline    Aborted by host               90%      1457         -
#12  Extended offline    Aborted by host               90%      1457         -
#13  Extended offline    Aborted by host               90%      1456         -
#14  Short offline       Aborted by host               90%      1456         -
#15  Short offline       Aborted by host               50%      1456         -
#16  Short offline       Completed without error       00%      1456         -
#17  Short offline       Aborted by host               90%      1456         -
#18  Short offline       Aborted by host               90%      1456         -
#19  Short offline       Completed without error       00%      1456         -

SMART Selective self-test log data structure revision number 1
 SPAN  MIN_LBA  MAX_LBA  CURRENT_TEST_STATUS
    1        0        0  Not_testing
    2        0        0  Not_testing
    3        0        0  Not_testing
    4        0        0  Not_testing
    5        0        0  Not_testing
Selective self-test flags (0x0):
  After scanning selected spans, do NOT read-scan remainder of disk.
If Selective self-test is pending on power-up, resume after 0 minute delay.

SCT Status Version:                  2
SCT Version (vendor specific):       1 (0x0001)
SCT Support Level:                   1
Device State:                        Active (0)
Current Temperature:                    30 Celsius
Power Cycle Min/Max Temperature:     24/31 Celsius
Lifetime    Min/Max Temperature:     13/43 Celsius
Lifetime    Average Temperature:        32 Celsius
Under/Over Temperature Limit Count:   0/0

SCT Temperature History Version:     2
Temperature Sampling Period:         1 minute
Temperature Logging Interval:        10 minutes
Min/Max recommended Temperature:     15/55 Celsius
Min/Max Temperature Limit:           10/60 Celsius
Temperature History Size (Index):    478 (323)

SCT Error Recovery Control:
           Read: Disabled
          Write: Disabled

Device Statistics (GP Log 0x04)
Page  Offset Size        Value Flags Description
0x01  =====  =               =  ===  == General Statistics (rev 2) ==
0x01  0x008  4            2584  ---  Lifetime Power-On Resets
0x01  0x010  4            3434  ---  Power-on Hours
0x01  0x018  6     10422561469  ---  Logical Sectors Written
0x01  0x020  6        72709070  ---  Number of Write Commands
0x01  0x028  6      6418257543  ---  Logical Sectors Read
0x01  0x030  6       100438799  ---  Number of Read Commands
0x02  =====  =               =  ===  == Free-Fall Statistics (rev 1) ==
0x02  0x010  4              34  ---  Overlimit Shock Events
0x03  =====  =               =  ===  == Rotating Media Statistics (rev 1) ==
0x03  0x008  4            3414  ---  Spindle Motor Power-on Hours
0x03  0x010  4            2964  ---  Head Flying Hours
0x03  0x018  4           38011  ---  Head Load Events
0x03  0x020  4               8  ---  Number of Reallocated Logical Sectors
0x03  0x028  4               0  ---  Read Recovery Attempts
0x03  0x030  4               0  ---  Number of Mechanical Start Failures
0x04  =====  =               =  ===  == General Errors Statistics (rev 1) ==
0x04  0x008  4               0  ---  Number of Reported Uncorrectable Errors
0x04  0x010  4               2  ---  Resets Between Cmd Acceptance and Completion
0x05  =====  =               =  ===  == Temperature Statistics (rev 1) ==
0x05  0x008  1              30  ---  Current Temperature
0x05  0x010  1              31  N--  Average Short Term Temperature
0x05  0x018  1              30  N--  Average Long Term Temperature
0x05  0x020  1              43  ---  Highest Temperature
0x05  0x028  1              13  ---  Lowest Temperature
0x05  0x030  1              39  N--  Highest Average Short Term Temperature
0x05  0x038  1              28  N--  Lowest Average Short Term Temperature
0x05  0x040  1              34  N--  Highest Average Long Term Temperature
0x05  0x048  1              30  N--  Lowest Average Long Term Temperature
0x05  0x050  4               0  ---  Time in Over-Temperature
0x05  0x058  1              55  ---  Specified Maximum Operating Temperature
0x05  0x060  4               1  ---  Time in Under-Temperature
0x05  0x068  1              15  ---  Specified Minimum Operating Temperature
0x06  =====  =               =  ===  == Transport Statistics (rev 1) ==
0x06  0x008  4           13425  ---  Number of Hardware Resets
0x06  0x018  4               0  ---  Number of Interface CRC Errors
0x07  =====  =               =  ===  == Solid State Device Statistics (rev 1) ==
0x07  0x008  1               5  N--  Percentage Used Endurance Indicator
                                |||_ C monitored condition met
                                ||__ D supports DSN
                                |___ N normalized value

Pending Defects log (GP Log 0x0c) not supported

SATA Phy Event Counters (GP Log 0x11)
ID      Size     Value  Description
0x0001  4            0  Command failed due to ICRC error
0x0002  4            0  R_ERR response for data FIS
0x0003  4            0  R_ERR response for device-to-host data FIS
0x0004  4            0  R_ERR response for host-to-device data FIS
0x0005  4            0  R_ERR response for non-data FIS
0x0006  4            0  R_ERR response for device-to-host non-data FIS
0x0007  4            0  R_ERR response for host-to-device non-data FIS
0x0008  4            0  Device-to-host non-data FIS retries
0x0009  4            3  Transition from drive PhyRdy to drive PhyNRdy
0x000a  4            3  Device-to-host register FISes sent due to a COMRESET
0x000b  4            0  CRC errors within host-to-device FIS
0x000d  4            0  Non-CRC errors within host-to-device FIS
0x000f  4            0  R_ERR response for host-to-device data FIS, CRC
0x0010  4            0  R_ERR response for host-to-device data FIS, non-CRC
0x0012  4            0  R_ERR response for host-to-device non-data FIS, CRC
0x0013  4            0  R_ERR response for host-to-device non-data FIS, non-CRC

