=== START OF INFORMATION SECTION ===
Model Family:     Western Digital Caviar Blue (SATA)
Device Model:     WDC WD5000AAKS-08V0A0
Serial Number:    --
LU WWN Device Id: 5 0014ee ...
Firmware Version: 05.01D05
User Capacity:    500 106 780 160 bytes [500 GB]
Sector Size:      512 bytes logical/physical
Rotation Rate:    7200 rpm
Device is:        In smartctl database [for details use: -P show]
ATA Version is:   ATA8-ACS (minor revision not indicated)
SATA Version is:  SATA 2.6, 3.0 Gb/s
Local Time is:    Tue Jan  3 21:52:07 2017 +06
SMART support is: Available - device has SMART capability.
SMART support is: Enabled
AAM level is:     128 (quiet), recommended: 128
APM feature is:   Unavailable
Rd look-ahead is: Enabled
Write cache is:   Enabled
ATA Security is:  Disabled, frozen [SEC2]
Wt Cache Reorder: Enabled

=== START OF READ SMART DATA SECTION ===
SMART overall-health self-assessment test result: PASSED

General SMART Values:
Offline data collection status:  (0x84)	Offline data collection activity
					was suspended by an interrupting command from host.
					Auto Offline Data Collection: Enabled.
Self-test execution status:      (   0)	The previous self-test routine completed
					without error or no self-test has ever 
					been run.
Total time to complete Offline 
data collection: 		( 8160) seconds.
Offline data collection
capabilities: 			 (0x7b) SMART execute Offline immediate.
					Auto Offline data collection on/off support.
					Suspend Offline collection upon new
					command.
					Offline surface scan supported.
					Self-test supported.
					Conveyance Self-test supported.
					Selective Self-test supported.
SMART capabilities:            (0x0003)	Saves SMART data before entering
					power-saving mode.
					Supports SMART auto save timer.
Error logging capability:        (0x01)	Error logging supported.
					General Purpose Logging supported.
Short self-test routine 
recommended polling time: 	 (   2) minutes.
Extended self-test routine
recommended polling time: 	 (  97) minutes.
Conveyance self-test routine
recommended polling time: 	 (   5) minutes.
SCT capabilities: 	       (0x3037)	SCT Status supported.
					SCT Feature Control supported.
					SCT Data Table supported.

SMART Attributes Data Structure revision number: 16
Vendor Specific SMART Attributes with Thresholds:
ID# ATTRIBUTE_NAME          FLAGS    VALUE WORST THRESH FAIL RAW_VALUE
  1 Raw_Read_Error_Rate     POSR-K   200   200   051    -    4406
  3 Spin_Up_Time            POS--K   138   137   021    -    4100
  4 Start_Stop_Count        -O--CK   095   095   000    -    5263
  5 Reallocated_Sector_Ct   PO--CK   200   200   140    -    0
  7 Seek_Error_Rate         -OSR-K   200   200   000    -    0
  9 Power_On_Hours          -O--CK   080   080   000    -    14876
 10 Spin_Retry_Count        -O--CK   100   100   000    -    0
 11 Calibration_Retry_Count -O--CK   100   100   000    -    0
 12 Power_Cycle_Count       -O--CK   095   095   000    -    5094
192 Power-Off_Retract_Count -O--CK   199   199   000    -    1185
193 Load_Cycle_Count        -O--CK   199   199   000    -    4077
194 Temperature_Celsius     -O---K   108   097   000    -    35
196 Reallocated_Event_Count -O--CK   200   200   000    -    0
197 Current_Pending_Sector  -O--CK   200   200   000    -    0
198 Offline_Uncorrectable   ----CK   200   200   000    -    0
199 UDMA_CRC_Error_Count    -O--CK   200   200   000    -    0
200 Multi_Zone_Error_Rate   ---R--   200   200   000    -    0
                            ||||||_ K auto-keep
                            |||||__ C event count
                            ||||___ R error rate
                            |||____ S speed/performance
                            ||_____ O updated online
                            |______ P prefailure warning

General Purpose Log Directory Version 1
SMART           Log Directory Version 1 [multi-sector log support]
Address    Access  R/W   Size  Description
0x00       GPL,SL  R/O      1  Log Directory
0x01           SL  R/O      1  Summary SMART error log
0x02           SL  R/O      5  Comprehensive SMART error log
0x03       GPL     R/O      6  Ext. Comprehensive SMART error log
0x06           SL  R/O      1  SMART self-test log
0x07       GPL     R/O      1  Extended self-test log
0x09           SL  R/W      1  Selective self-test log
0x10       GPL     R/O      1  SATA NCQ Queued Error log
0x11       GPL     R/O      1  SATA Phy Event Counters log
0x80-0x9f  GPL,SL  R/W     16  Host vendor specific log
0xa0-0xa7  GPL,SL  VS      16  Device vendor specific log
0xa8-0xb5  GPL,SL  VS       1  Device vendor specific log
0xb6       GPL     VS       1  Device vendor specific log
0xb7       GPL,SL  VS       1  Device vendor specific log
0xc0       GPL,SL  VS       1  Device vendor specific log
0xc1       GPL     VS      24  Device vendor specific log
0xe0       GPL,SL  R/W      1  SCT Command/Status
0xe1       GPL,SL  R/W      1  SCT Data Transfer

SMART Extended Comprehensive Error Log Version: 1 (6 sectors)
Device Error Count: 4527 (device log contains only the most recent 24 errors)
	CR     = Command Register
	FEATR  = Features Register
	COUNT  = Count (was: Sector Count) Register
	LBA_48 = Upper bytes of LBA High/Mid/Low Registers ]  ATA-8
	LH     = LBA High (was: Cylinder High) Register    ]   LBA
	LM     = LBA Mid (was: Cylinder Low) Register      ] Register
	LL     = LBA Low (was: Sector Number) Register     ]
	DV     = Device (was: Device/Head) Register
	DC     = Device Control Register
	ER     = Error register
	ST     = Status register
Powered_Up_Time is measured from power on, and printed as
DDd+hh:mm:SS.sss where DD=days, hh=hours, mm=minutes,
SS=sec, and sss=millisec. It "wraps" after 49.710 days.

Error 4527 [14] occurred at disk power-on lifetime: 8466 hours (352 days + 18 hours)
  When the command that caused the error occurred, the device was active or idle.

  After command completion occurred, registers were:
  ER -- ST COUNT  LBA_48  LH LM LL DV DC
  -- -- -- == -- == == == -- -- -- -- --
  40 -- 51 00 08 00 00 33 9f 74 e2 40 00  Error: UNC 8 sectors at LBA = 0x339f74e2 = 866088162

  Commands leading to the command that caused the error were:
  CR FEATR COUNT  LBA_48  LH LM LL DV DC  Powered_Up_Time  Command/Feature_Name
  -- == -- == -- == == == -- -- -- -- --  ---------------  --------------------
  25 00 00 00 08 00 00 33 9f 74 e2 40 00     00:04:23.987  READ DMA EXT
  35 00 00 00 08 00 00 33 de 9a 32 40 00     00:04:23.987  WRITE DMA EXT
  25 00 00 00 10 00 00 33 cf e0 4a 40 00     00:04:23.986  READ DMA EXT
  25 00 00 00 08 00 00 33 9f 74 e2 40 00     00:04:22.176  READ DMA EXT
  35 00 00 00 08 00 00 33 de 9a 2a 40 00     00:04:22.176  WRITE DMA EXT

Error 4526 [13] occurred at disk power-on lifetime: 8466 hours (352 days + 18 hours)
  When the command that caused the error occurred, the device was active or idle.

  After command completion occurred, registers were:
  ER -- ST COUNT  LBA_48  LH LM LL DV DC
  -- -- -- == -- == == == -- -- -- -- --
  40 -- 51 00 08 00 00 33 9f 74 e2 40 00  Error: UNC 8 sectors at LBA = 0x339f74e2 = 866088162

  Commands leading to the command that caused the error were:
  CR FEATR COUNT  LBA_48  LH LM LL DV DC  Powered_Up_Time  Command/Feature_Name
  -- == -- == -- == == == -- -- -- -- --  ---------------  --------------------
  25 00 00 00 08 00 00 33 9f 74 e2 40 00     00:04:22.176  READ DMA EXT
  35 00 00 00 08 00 00 33 de 9a 2a 40 00     00:04:22.176  WRITE DMA EXT
  25 00 00 00 60 00 00 33 cf de 8a 40 00     00:04:22.154  READ DMA EXT
  25 00 00 00 08 00 00 33 9f 74 e2 40 00     00:04:20.346  READ DMA EXT
  25 00 00 00 08 00 00 33 e3 2d 82 40 00     00:04:20.324  READ DMA EXT

Error 4525 [12] occurred at disk power-on lifetime: 8466 hours (352 days + 18 hours)
  When the command that caused the error occurred, the device was active or idle.

  After command completion occurred, registers were:
  ER -- ST COUNT  LBA_48  LH LM LL DV DC
  -- -- -- == -- == == == -- -- -- -- --
  40 -- 51 00 08 00 00 33 9f 74 e2 40 00  Error: UNC 8 sectors at LBA = 0x339f74e2 = 866088162

  Commands leading to the command that caused the error were:
  CR FEATR COUNT  LBA_48  LH LM LL DV DC  Powered_Up_Time  Command/Feature_Name
  -- == -- == -- == == == -- -- -- -- --  ---------------  --------------------
  25 00 00 00 08 00 00 33 9f 74 e2 40 00     00:04:20.346  READ DMA EXT
  25 00 00 00 08 00 00 33 e3 2d 82 40 00     00:04:20.324  READ DMA EXT
  35 00 00 00 08 00 00 33 de 9a b2 40 00     00:04:20.323  WRITE DMA EXT
  25 00 00 00 08 00 00 33 9f 74 e2 40 00     00:04:18.501  READ DMA EXT
  35 00 00 00 08 00 00 33 de 9b ea 40 00     00:04:18.501  WRITE DMA EXT

Error 4524 [11] occurred at disk power-on lifetime: 8466 hours (352 days + 18 hours)
  When the command that caused the error occurred, the device was active or idle.

  After command completion occurred, registers were:
  ER -- ST COUNT  LBA_48  LH LM LL DV DC
  -- -- -- == -- == == == -- -- -- -- --
  40 -- 51 00 08 00 00 33 9f 74 e2 40 00  Error: UNC 8 sectors at LBA = 0x339f74e2 = 866088162

  Commands leading to the command that caused the error were:
  CR FEATR COUNT  LBA_48  LH LM LL DV DC  Powered_Up_Time  Command/Feature_Name
  -- == -- == -- == == == -- -- -- -- --  ---------------  --------------------
  25 00 00 00 08 00 00 33 9f 74 e2 40 00     00:04:18.501  READ DMA EXT
  35 00 00 00 08 00 00 33 de 9b ea 40 00     00:04:18.501  WRITE DMA EXT
  25 00 00 00 08 00 00 33 b4 cb ba 40 00     00:04:18.500  READ DMA EXT
  25 00 00 00 08 00 00 33 9f 74 e2 40 00     00:04:16.678  READ DMA EXT
  35 00 00 00 10 00 00 33 82 b1 1a 40 00     00:04:16.678  WRITE DMA EXT

Error 4523 [10] occurred at disk power-on lifetime: 8466 hours (352 days + 18 hours)
  When the command that caused the error occurred, the device was active or idle.

  After command completion occurred, registers were:
  ER -- ST COUNT  LBA_48  LH LM LL DV DC
  -- -- -- == -- == == == -- -- -- -- --
  40 -- 51 00 08 00 00 33 9f 74 e2 40 00  Error: UNC 8 sectors at LBA = 0x339f74e2 = 866088162

  Commands leading to the command that caused the error were:
  CR FEATR COUNT  LBA_48  LH LM LL DV DC  Powered_Up_Time  Command/Feature_Name
  -- == -- == -- == == == -- -- -- -- --  ---------------  --------------------
  25 00 00 00 08 00 00 33 9f 74 e2 40 00     00:04:16.678  READ DMA EXT
  35 00 00 00 10 00 00 33 82 b1 1a 40 00     00:04:16.678  WRITE DMA EXT
  25 00 00 00 08 00 00 33 b4 cc 2a 40 00     00:04:16.677  READ DMA EXT
  25 00 00 00 08 00 00 33 9f 74 e2 40 00     00:04:14.855  READ DMA EXT
  25 00 00 00 40 00 00 33 cb d9 e2 40 00     00:04:14.854  READ DMA EXT

Error 4522 [9] occurred at disk power-on lifetime: 8466 hours (352 days + 18 hours)
  When the command that caused the error occurred, the device was active or idle.

  After command completion occurred, registers were:
  ER -- ST COUNT  LBA_48  LH LM LL DV DC
  -- -- -- == -- == == == -- -- -- -- --
  40 -- 51 00 08 00 00 33 9f 74 e2 40 00  Error: UNC 8 sectors at LBA = 0x339f74e2 = 866088162

  Commands leading to the command that caused the error were:
  CR FEATR COUNT  LBA_48  LH LM LL DV DC  Powered_Up_Time  Command/Feature_Name
  -- == -- == -- == == == -- -- -- -- --  ---------------  --------------------
  25 00 00 00 08 00 00 33 9f 74 e2 40 00     00:04:14.855  READ DMA EXT
  25 00 00 00 40 00 00 33 cb d9 e2 40 00     00:04:14.854  READ DMA EXT
  25 00 00 00 08 00 00 33 9f 74 e2 40 00     00:04:13.047  READ DMA EXT
  25 00 00 00 40 00 00 33 cb d9 e2 40 00     00:04:13.047  READ DMA EXT
  25 00 00 00 08 00 00 33 9f 74 e2 40 00     00:04:11.235  READ DMA EXT

Error 4521 [8] occurred at disk power-on lifetime: 8466 hours (352 days + 18 hours)
  When the command that caused the error occurred, the device was active or idle.

  After command completion occurred, registers were:
  ER -- ST COUNT  LBA_48  LH LM LL DV DC
  -- -- -- == -- == == == -- -- -- -- --
  40 -- 51 00 08 00 00 33 9f 74 e2 40 00  Error: UNC 8 sectors at LBA = 0x339f74e2 = 866088162

  Commands leading to the command that caused the error were:
  CR FEATR COUNT  LBA_48  LH LM LL DV DC  Powered_Up_Time  Command/Feature_Name
  -- == -- == -- == == == -- -- -- -- --  ---------------  --------------------
  25 00 00 00 08 00 00 33 9f 74 e2 40 00     00:04:13.047  READ DMA EXT
  25 00 00 00 40 00 00 33 cb d9 e2 40 00     00:04:13.047  READ DMA EXT
  25 00 00 00 08 00 00 33 9f 74 e2 40 00     00:04:11.235  READ DMA EXT
  35 00 00 00 08 00 00 33 e3 12 02 40 00     00:04:11.235  WRITE DMA EXT
  25 00 00 00 68 00 00 33 cb d7 72 40 00     00:04:11.216  READ DMA EXT

Error 4520 [7] occurred at disk power-on lifetime: 8466 hours (352 days + 18 hours)
  When the command that caused the error occurred, the device was active or idle.

  After command completion occurred, registers were:
  ER -- ST COUNT  LBA_48  LH LM LL DV DC
  -- -- -- == -- == == == -- -- -- -- --
  40 -- 51 00 08 00 00 33 9f 74 e2 40 00  Error: UNC 8 sectors at LBA = 0x339f74e2 = 866088162

  Commands leading to the command that caused the error were:
  CR FEATR COUNT  LBA_48  LH LM LL DV DC  Powered_Up_Time  Command/Feature_Name
  -- == -- == -- == == == -- -- -- -- --  ---------------  --------------------
  25 00 00 00 08 00 00 33 9f 74 e2 40 00     00:04:11.235  READ DMA EXT
  35 00 00 00 08 00 00 33 e3 12 02 40 00     00:04:11.235  WRITE DMA EXT
  25 00 00 00 68 00 00 33 cb d7 72 40 00     00:04:11.216  READ DMA EXT
  25 00 00 00 08 00 00 33 9f 74 e2 40 00     00:04:09.384  READ DMA EXT
  25 00 00 00 08 00 00 33 e3 37 ba 40 00     00:04:09.384  READ DMA EXT

SMART Extended Self-test Log Version: 1 (1 sectors)
Num  Test_Description    Status                  Remaining  LifeTime(hours)  LBA_of_first_error
# 1  Extended offline    Completed without error       00%     14788         -
# 2  Extended offline    Completed without error       00%     14258         -
# 3  Short offline       Completed without error       00%     12322         -

SMART Selective self-test log data structure revision number 1
 SPAN  MIN_LBA  MAX_LBA  CURRENT_TEST_STATUS
    1        0        0  Not_testing
    2        0        0  Not_testing
    3        0        0  Not_testing
    4        0        0  Not_testing
    5        0        0  Not_testing
Selective self-test flags (0x0):
  After scanning selected spans, do NOT read-scan remainder of disk.
If Selective self-test is pending on power-up, resume after 0 minute delay.

SCT Status Version:                  2
SCT Version (vendor specific):       258 (0x0102)
SCT Support Level:                   1
Device State:                        Active (0)
Current Temperature:                    35 Celsius
Power Cycle Min/Max Temperature:     34/35 Celsius
Lifetime    Min/Max Temperature:     34/46 Celsius
Under/Over Temperature Limit Count:   0/0

SCT Temperature History Version:     2
Temperature Sampling Period:         1 minute
Temperature Logging Interval:        1 minute
Min/Max recommended Temperature:      0/60 Celsius
Min/Max Temperature Limit:           -41/85 Celsius
Temperature History Size (Index):    478 (177)

SCT Error Recovery Control command not supported

Device Statistics (GP/SMART Log 0x04) not supported

SATA Phy Event Counters (GP Log 0x11)
ID      Size     Value  Description
0x0001  2            0  Command failed due to ICRC error
0x0002  2            0  R_ERR response for data FIS
0x0003  2            0  R_ERR response for device-to-host data FIS
0x0004  2            0  R_ERR response for host-to-device data FIS
0x0005  2            0  R_ERR response for non-data FIS
0x0006  2            0  R_ERR response for device-to-host non-data FIS
0x0007  2            0  R_ERR response for host-to-device non-data FIS
0x000a  2            2  Device-to-host register FISes sent due to a COMRESET
0x000b  2            0  CRC errors within host-to-device FIS
0x8000  4          203  Vendor specific



