=== START OF INFORMATION SECTION ===
Device Model:     KINGMAX SSD 240GB
Serial Number:    --
Firmware Version: M1024E
User Capacity:    240 057 409 536 bytes [240 GB]
Sector Size:      512 bytes logical/physical
Rotation Rate:    Solid State Device
Device is:        Not in smartctl database [for details use: -P showall]
ATA Version is:   ACS-2 (minor revision not indicated)
SATA Version is:  SATA 3.1, 6.0 Gb/s
Local Time is:    Sun Jun  7 20:02:57 2015 MSK
SMART support is: Available - device has SMART capability.
SMART support is: Enabled
AAM feature is:   Disabled
APM feature is:   Unavailable
Rd look-ahead is: Disabled
Write cache is:   Enabled
ATA Security is:  Disabled, NOT FROZEN [SEC1]
Wt Cache Reorder: Unavailable

=== START OF READ SMART DATA SECTION ===
SMART overall-health self-assessment test result: PASSED

General SMART Values:
Offline data collection status:  (0x00)	Offline data collection activity
					was never started.
					Auto Offline Data Collection: Disabled.
Self-test execution status:      (   0)	The previous self-test routine completed
					without error or no self-test has ever 
					been run.
Total time to complete Offline 
data collection: 		(    0) seconds.
Offline data collection
capabilities: 			 (0x75) SMART execute Offline immediate.
					No Auto Offline data collection support.
					Abort Offline collection upon new
					command.
					No Offline surface scan supported.
					Self-test supported.
					Conveyance Self-test supported.
					Selective Self-test supported.
SMART capabilities:            (0x0002)	Does not save SMART data before
					entering power-saving mode.
					Supports SMART auto save timer.
Error logging capability:        (0x01)	Error logging supported.
					General Purpose Logging supported.
Short self-test routine 
recommended polling time: 	 (   3) minutes.
Extended self-test routine
recommended polling time: 	 (  40) minutes.
Conveyance self-test routine
recommended polling time: 	 (   2) minutes.

SMART Attributes Data Structure revision number: 1
Vendor Specific SMART Attributes with Thresholds:
ID# ATTRIBUTE_NAME          FLAGS    VALUE WORST THRESH FAIL RAW_VALUE
  1 Raw_Read_Error_Rate     ------   100   100   000    -    0
  5 Reallocated_Sector_Ct   ------   100   100   000    -    0
  9 Power_On_Hours          ------   100   100   000    -    40
 12 Power_Cycle_Count       ------   100   100   000    -    784
192 Power-Off_Retract_Count ------   100   100   000    -    92
194 Temperature_Celsius     ------   100   100   000    -    28
195 Hardware_ECC_Recovered  ------   100   100   000    -    65517
196 Reallocated_Event_Count ------   080   080   040    -    0
199 UDMA_CRC_Error_Count    ------   100   100   050    -    16
160 Unknown_Attribute       ------   100   100   000    -    0
161 Unknown_Attribute       ------   100   100   000    -    80
163 Unknown_Attribute       ------   100   100   000    -    26
164 Unknown_Attribute       ------   100   100   000    -    18358
165 Unknown_Attribute       ------   100   100   050    -    86
166 Unknown_Attribute       ------   100   100   050    -    0
167 Unknown_Attribute       ------   100   100   000    -    18
241 Total_LBAs_Written      ------   100   100   000    -    55302
242 Total_LBAs_Read         ------   100   100   000    -    44777
168 Unknown_Attribute       ------   100   100   000    -    3000
169 Unknown_Attribute       ------   100   100   000    -    100
                            ||||||_ K auto-keep
                            |||||__ C event count
                            ||||___ R error rate
                            |||____ S speed/performance
                            ||_____ O updated online
                            |______ P prefailure warning

General Purpose Log Directory Version 1
SMART           Log Directory Version 1 [multi-sector log support]
Address    Access  R/W   Size  Description
0x00       GPL,SL  R/O      1  Log Directory
0x01       GPL,SL  R/O      1  Summary SMART error log
0x02       GPL,SL  R/O      1  Comprehensive SMART error log
0x03       GPL,SL  R/O      1  Ext. Comprehensive SMART error log
0x04       GPL,SL  R/O      8  Device Statistics log
0x06       GPL,SL  R/O      1  SMART self-test log
0x07       GPL,SL  R/O      1  Extended self-test log
0x09       GPL,SL  R/W      1  Selective self-test log
0x10       GPL,SL  R/O      1  NCQ Command Error log
0x30       GPL,SL  R/O      9  IDENTIFY DEVICE data log
0x80-0x9f  GPL,SL  R/W     16  Host vendor specific log

SMART Extended Comprehensive Error Log Version: 1 (1 sectors)
No Errors Logged

SMART Extended Self-test Log Version: 1 (1 sectors)
No self-tests have been logged.  [To run self-tests, use: smartctl -t]

SMART Selective self-test log data structure revision number 1
 SPAN  MIN_LBA  MAX_LBA  CURRENT_TEST_STATUS
    1        0        0  Not_testing
    2        0        0  Not_testing
    3        0        0  Not_testing
    4        0        0  Not_testing
    5        0        0  Not_testing
Selective self-test flags (0x0):
  After scanning selected spans, do NOT read-scan remainder of disk.
If Selective self-test is pending on power-up, resume after 0 minute delay.

SCT Commands not supported

Device Statistics (GP Log 0x04)
Page Offset Size         Value  Description
  1  =====  =                =  == General Statistics (rev 2) ==
  1  0x008  4              784  Lifetime Power-On Resets
  1  0x010  4               40  Power-on Hours
  1  0x018  6       3624279152  Logical Sectors Written
  1  0x020  6         46450680  Number of Write Commands
  1  0x028  6       2934536760  Logical Sectors Read
  1  0x030  6         43600622  Number of Read Commands
  2  =====  =                =  == Free-Fall Statistics (empty) ==
  3  =====  =                =  == Rotating Media Statistics (empty) ==
  4  =====  =                =  == General Errors Statistics (rev 1) ==
  4  0x008  4                0  Number of Reported Uncorrectable Errors
  4  0x010  4              108  Resets Between Cmd Acceptance and Completion
  5  =====  =                =  == Temperature Statistics (empty) ==
  6  =====  =                =  == Transport Statistics (rev 1) ==
  6  0x008  4             5766  Number of Hardware Resets
  6  0x018  4               16  Number of Interface CRC Errors
  7  =====  =                =  == Solid State Device Statistics (rev 1) ==
  7  0x008  1                0  Percentage Used Endurance Indicator

SATA Phy Event Counters (GP Log 0x11) not supported

