=== START OF INFORMATION SECTION ===
Model Family:     Western Digital Caviar Blue Serial ATA
Device Model:     WDC WD1600AAJS-00B4A0
Serial Number:    --
LU WWN Device Id: 5 0014ee ...
Firmware Version: 01.03A01
User Capacity:    160 040 803 840 bytes [160 GB]
Sector Size:      512 bytes logical/physical
Device is:        In smartctl database [for details use: -P show]
ATA Version is:   ATA8-ACS (minor revision not indicated)
SATA Version is:  SATA 2.5, 3.0 Gb/s
Local Time is:    Wed Sep 28 19:17:13 2016 MSK
SMART support is: Available - device has SMART capability.
SMART support is: Enabled
AAM feature is:   Disabled
APM feature is:   Unavailable
Rd look-ahead is: Enabled
Write cache is:   Enabled
ATA Security is:  Disabled, frozen [SEC2]
Wt Cache Reorder: Enabled

=== START OF READ SMART DATA SECTION ===
SMART overall-health self-assessment test result: PASSED

General SMART Values:
Offline data collection status:  (0x84)	Offline data collection activity
					was suspended by an interrupting command from host.
					Auto Offline Data Collection: Enabled.
Self-test execution status:      (   0)	The previous self-test routine completed
					without error or no self-test has ever 
					been run.
Total time to complete Offline 
data collection: 		( 2880) seconds.
Offline data collection
capabilities: 			 (0x7b) SMART execute Offline immediate.
					Auto Offline data collection on/off support.
					Suspend Offline collection upon new
					command.
					Offline surface scan supported.
					Self-test supported.
					Conveyance Self-test supported.
					Selective Self-test supported.
SMART capabilities:            (0x0003)	Saves SMART data before entering
					power-saving mode.
					Supports SMART auto save timer.
Error logging capability:        (0x01)	Error logging supported.
					General Purpose Logging supported.
Short self-test routine 
recommended polling time: 	 (   2) minutes.
Extended self-test routine
recommended polling time: 	 (  38) minutes.
Conveyance self-test routine
recommended polling time: 	 (   5) minutes.
SCT capabilities: 	       (0x303f)	SCT Status supported.
					SCT Error Recovery Control supported.
					SCT Feature Control supported.
					SCT Data Table supported.

SMART Attributes Data Structure revision number: 16
Vendor Specific SMART Attributes with Thresholds:
ID# ATTRIBUTE_NAME          FLAGS    VALUE WORST THRESH FAIL RAW_VALUE
  1 Raw_Read_Error_Rate     POSR-K   200   200   051    -    1848
  3 Spin_Up_Time            POS--K   154   153   021    -    3291
  4 Start_Stop_Count        -O--CK   098   098   000    -    2449
  5 Reallocated_Sector_Ct   PO--CK   200   200   140    -    0
  7 Seek_Error_Rate         -OSR-K   200   200   000    -    0
  9 Power_On_Hours          -O--CK   078   078   000    -    16566
 10 Spin_Retry_Count        -O--CK   100   100   000    -    0
 11 Calibration_Retry_Count -O--CK   100   100   000    -    0
 12 Power_Cycle_Count       -O--CK   098   098   000    -    2270
192 Power-Off_Retract_Count -O--CK   200   200   000    -    654
193 Load_Cycle_Count        -O--CK   200   200   000    -    2449
194 Temperature_Celsius     -O---K   110   087   000    -    33
196 Reallocated_Event_Count -O--CK   200   200   000    -    0
197 Current_Pending_Sector  -O--CK   200   200   000    -    0
198 Offline_Uncorrectable   ----CK   200   200   000    -    1
199 UDMA_CRC_Error_Count    -O--CK   200   200   000    -    1
200 Multi_Zone_Error_Rate   ---R--   200   200   000    -    0
                            ||||||_ K auto-keep
                            |||||__ C event count
                            ||||___ R error rate
                            |||____ S speed/performance
                            ||_____ O updated online
                            |______ P prefailure warning

General Purpose Log Directory Version 1
SMART           Log Directory Version 1 [multi-sector log support]
Address    Access  R/W   Size  Description
0x00       GPL,SL  R/O      1  Log Directory
0x01           SL  R/O      1  Summary SMART error log
0x02           SL  R/O      5  Comprehensive SMART error log
0x03       GPL     R/O      6  Ext. Comprehensive SMART error log
0x06           SL  R/O      1  SMART self-test log
0x07       GPL     R/O      1  Extended self-test log
0x09           SL  R/W      1  Selective self-test log
0x10       GPL     R/O      1  SATA NCQ Queued Error log
0x11       GPL     R/O      1  SATA Phy Event Counters log
0x80-0x9f  GPL,SL  R/W     16  Host vendor specific log
0xa0-0xa7  GPL,SL  VS      16  Device vendor specific log
0xa8-0xb7  GPL,SL  VS       1  Device vendor specific log
0xc0       GPL,SL  VS       1  Device vendor specific log
0xc1       GPL     VS      24  Device vendor specific log
0xe0       GPL,SL  R/W      1  SCT Command/Status
0xe1       GPL,SL  R/W      1  SCT Data Transfer

SMART Extended Comprehensive Error Log Version: 1 (6 sectors)
Device Error Count: 1590 (device log contains only the most recent 24 errors)
	CR     = Command Register
	FEATR  = Features Register
	COUNT  = Count (was: Sector Count) Register
	LBA_48 = Upper bytes of LBA High/Mid/Low Registers ]  ATA-8
	LH     = LBA High (was: Cylinder High) Register    ]   LBA
	LM     = LBA Mid (was: Cylinder Low) Register      ] Register
	LL     = LBA Low (was: Sector Number) Register     ]
	DV     = Device (was: Device/Head) Register
	DC     = Device Control Register
	ER     = Error register
	ST     = Status register
Powered_Up_Time is measured from power on, and printed as
DDd+hh:mm:SS.sss where DD=days, hh=hours, mm=minutes,
SS=sec, and sss=millisec. It "wraps" after 49.710 days.

Error 1590 [5] occurred at disk power-on lifetime: 15876 hours (661 days + 12 hours)
  When the command that caused the error occurred, the device was active or idle.

  After command completion occurred, registers were:
  ER -- ST COUNT  LBA_48  LH LM LL DV DC
  -- -- -- == -- == == == -- -- -- -- --
  04 -- 41 00 00 00 00 00 3c f8 00 ec 00  Error: ABRT at LBA = 0x0c3cf800 = 205322240

  Commands leading to the command that caused the error were:
  CR FEATR COUNT  LBA_48  LH LM LL DV DC  Powered_Up_Time  Command/Feature_Name
  -- == -- == -- == == == -- -- -- -- --  ---------------  --------------------
  c8 00 00 00 08 00 00 00 3c f8 00 ec 08  8d+14:08:37.184  READ DMA
  27 00 00 00 00 00 00 00 00 00 00 e0 08  8d+14:08:37.184  READ NATIVE MAX ADDRESS EXT [OBS-ACS-3]
  ec 00 00 00 00 00 00 00 00 00 00 a0 08  8d+14:08:37.181  IDENTIFY DEVICE
  ef 00 03 00 46 00 00 00 00 00 00 a0 08  8d+14:08:37.181  SET FEATURES [Set transfer mode]
  27 00 00 00 00 00 00 00 00 00 00 e0 08  8d+14:08:37.181  READ NATIVE MAX ADDRESS EXT [OBS-ACS-3]

Error 1589 [4] occurred at disk power-on lifetime: 15876 hours (661 days + 12 hours)
  When the command that caused the error occurred, the device was active or idle.

  After command completion occurred, registers were:
  ER -- ST COUNT  LBA_48  LH LM LL DV DC
  -- -- -- == -- == == == -- -- -- -- --
  04 -- 41 00 00 00 00 00 3c f8 00 ec 00  Error: ABRT at LBA = 0x0c3cf800 = 205322240

  Commands leading to the command that caused the error were:
  CR FEATR COUNT  LBA_48  LH LM LL DV DC  Powered_Up_Time  Command/Feature_Name
  -- == -- == -- == == == -- -- -- -- --  ---------------  --------------------
  c8 00 00 00 08 00 00 00 3c f8 00 ec 08  8d+14:08:20.554  READ DMA
  27 00 00 00 00 00 00 00 00 00 00 e0 08  8d+14:08:20.554  READ NATIVE MAX ADDRESS EXT [OBS-ACS-3]
  ec 00 00 00 00 00 00 00 00 00 00 a0 08  8d+14:08:20.551  IDENTIFY DEVICE
  ef 00 03 00 46 00 00 00 00 00 00 a0 08  8d+14:08:20.551  SET FEATURES [Set transfer mode]
  27 00 00 00 00 00 00 00 00 00 00 e0 08  8d+14:08:20.551  READ NATIVE MAX ADDRESS EXT [OBS-ACS-3]

Error 1588 [3] occurred at disk power-on lifetime: 15876 hours (661 days + 12 hours)
  When the command that caused the error occurred, the device was active or idle.

  After command completion occurred, registers were:
  ER -- ST COUNT  LBA_48  LH LM LL DV DC
  -- -- -- == -- == == == -- -- -- -- --
  04 -- 41 00 00 00 00 00 3c f8 00 ec 00  Error: ABRT at LBA = 0x0c3cf800 = 205322240

  Commands leading to the command that caused the error were:
  CR FEATR COUNT  LBA_48  LH LM LL DV DC  Powered_Up_Time  Command/Feature_Name
  -- == -- == -- == == == -- -- -- -- --  ---------------  --------------------
  c8 00 00 00 08 00 00 00 3c f8 00 ec 08  8d+14:08:03.666  READ DMA
  27 00 00 00 00 00 00 00 00 00 00 e0 08  8d+14:08:03.666  READ NATIVE MAX ADDRESS EXT [OBS-ACS-3]
  ec 00 00 00 00 00 00 00 00 00 00 a0 08  8d+14:08:03.662  IDENTIFY DEVICE
  ef 00 03 00 46 00 00 00 00 00 00 a0 08  8d+14:08:03.662  SET FEATURES [Set transfer mode]
  27 00 00 00 00 00 00 00 00 00 00 e0 08  8d+14:08:03.662  READ NATIVE MAX ADDRESS EXT [OBS-ACS-3]

Error 1587 [2] occurred at disk power-on lifetime: 15876 hours (661 days + 12 hours)
  When the command that caused the error occurred, the device was active or idle.

  After command completion occurred, registers were:
  ER -- ST COUNT  LBA_48  LH LM LL DV DC
  -- -- -- == -- == == == -- -- -- -- --
  04 -- 41 00 00 00 00 00 3c f8 00 ec 00  Error: ABRT at LBA = 0x0c3cf800 = 205322240

  Commands leading to the command that caused the error were:
  CR FEATR COUNT  LBA_48  LH LM LL DV DC  Powered_Up_Time  Command/Feature_Name
  -- == -- == -- == == == -- -- -- -- --  ---------------  --------------------
  c8 00 00 00 08 00 00 00 3c f8 00 ec 08  8d+14:07:47.144  READ DMA
  27 00 00 00 00 00 00 00 00 00 00 e0 08  8d+14:07:47.144  READ NATIVE MAX ADDRESS EXT [OBS-ACS-3]
  ec 00 00 00 00 00 00 00 00 00 00 a0 08  8d+14:07:47.140  IDENTIFY DEVICE
  ef 00 03 00 46 00 00 00 00 00 00 a0 08  8d+14:07:47.140  SET FEATURES [Set transfer mode]
  27 00 00 00 00 00 00 00 00 00 00 e0 08  8d+14:07:47.140  READ NATIVE MAX ADDRESS EXT [OBS-ACS-3]

Error 1586 [1] occurred at disk power-on lifetime: 15876 hours (661 days + 12 hours)
  When the command that caused the error occurred, the device was active or idle.

  After command completion occurred, registers were:
  ER -- ST COUNT  LBA_48  LH LM LL DV DC
  -- -- -- == -- == == == -- -- -- -- --
  04 -- 41 00 00 00 00 00 3c f8 00 ec 00  Error: ABRT at LBA = 0x0c3cf800 = 205322240

  Commands leading to the command that caused the error were:
  CR FEATR COUNT  LBA_48  LH LM LL DV DC  Powered_Up_Time  Command/Feature_Name
  -- == -- == -- == == == -- -- -- -- --  ---------------  --------------------
  c8 00 00 00 08 00 00 00 3c f8 00 ec 08  8d+14:07:29.176  READ DMA
  27 00 00 00 00 00 00 00 00 00 00 e0 08  8d+14:07:29.176  READ NATIVE MAX ADDRESS EXT [OBS-ACS-3]
  ec 00 00 00 00 00 00 00 00 00 00 a0 08  8d+14:07:29.173  IDENTIFY DEVICE
  ef 00 03 00 46 00 00 00 00 00 00 a0 08  8d+14:07:29.173  SET FEATURES [Set transfer mode]
  27 00 00 00 00 00 00 00 00 00 00 e0 08  8d+14:07:29.173  READ NATIVE MAX ADDRESS EXT [OBS-ACS-3]

Error 1585 [0] occurred at disk power-on lifetime: 15876 hours (661 days + 12 hours)
  When the command that caused the error occurred, the device was active or idle.

  After command completion occurred, registers were:
  ER -- ST COUNT  LBA_48  LH LM LL DV DC
  -- -- -- == -- == == == -- -- -- -- --
  04 -- 41 00 00 00 00 00 3c f8 00 ec 00  Error: ABRT at LBA = 0x0c3cf800 = 205322240

  Commands leading to the command that caused the error were:
  CR FEATR COUNT  LBA_48  LH LM LL DV DC  Powered_Up_Time  Command/Feature_Name
  -- == -- == -- == == == -- -- -- -- --  ---------------  --------------------
  c8 00 00 00 08 00 00 00 3c f8 00 ec 08  8d+14:07:12.061  READ DMA
  c8 00 00 00 08 00 00 00 bc f8 18 eb 08  8d+14:07:12.061  READ DMA
  c8 00 00 00 08 00 00 00 bc f8 10 eb 08  8d+14:07:12.061  READ DMA
  c8 00 00 00 08 00 00 00 bc f8 08 eb 08  8d+14:07:12.060  READ DMA
  c8 00 00 00 08 00 00 00 bc f8 00 eb 08  8d+14:07:12.047  READ DMA

Error 1584 [23] occurred at disk power-on lifetime: 15808 hours (658 days + 16 hours)
  When the command that caused the error occurred, the device was active or idle.

  After command completion occurred, registers were:
  ER -- ST COUNT  LBA_48  LH LM LL DV DC
  -- -- -- == -- == == == -- -- -- -- --
  04 -- 41 00 00 00 00 00 7c f9 00 ec 00  Error: ABRT at LBA = 0x0c7cf900 = 209516800

  Commands leading to the command that caused the error were:
  CR FEATR COUNT  LBA_48  LH LM LL DV DC  Powered_Up_Time  Command/Feature_Name
  -- == -- == -- == == == -- -- -- -- --  ---------------  --------------------
  c8 00 00 00 08 00 00 00 7c f9 00 ec 08  5d+18:18:47.562  READ DMA
  27 00 00 00 00 00 00 00 00 00 00 e0 08  5d+18:18:47.562  READ NATIVE MAX ADDRESS EXT [OBS-ACS-3]
  ec 00 00 00 00 00 00 00 00 00 00 a0 08  5d+18:18:47.558  IDENTIFY DEVICE
  ef 00 03 00 46 00 00 00 00 00 00 a0 08  5d+18:18:47.558  SET FEATURES [Set transfer mode]
  27 00 00 00 00 00 00 00 00 00 00 e0 08  5d+18:18:47.558  READ NATIVE MAX ADDRESS EXT [OBS-ACS-3]

Error 1583 [22] occurred at disk power-on lifetime: 15808 hours (658 days + 16 hours)
  When the command that caused the error occurred, the device was active or idle.

  After command completion occurred, registers were:
  ER -- ST COUNT  LBA_48  LH LM LL DV DC
  -- -- -- == -- == == == -- -- -- -- --
  04 -- 41 00 00 00 00 00 7c f9 00 ec 00  Error: ABRT at LBA = 0x0c7cf900 = 209516800

  Commands leading to the command that caused the error were:
  CR FEATR COUNT  LBA_48  LH LM LL DV DC  Powered_Up_Time  Command/Feature_Name
  -- == -- == -- == == == -- -- -- -- --  ---------------  --------------------
  c8 00 00 00 08 00 00 00 7c f9 00 ec 08  5d+18:18:30.496  READ DMA
  27 00 00 00 00 00 00 00 00 00 00 e0 08  5d+18:18:30.496  READ NATIVE MAX ADDRESS EXT [OBS-ACS-3]
  ec 00 00 00 00 00 00 00 00 00 00 a0 08  5d+18:18:30.493  IDENTIFY DEVICE
  ef 00 03 00 46 00 00 00 00 00 00 a0 08  5d+18:18:30.493  SET FEATURES [Set transfer mode]
  27 00 00 00 00 00 00 00 00 00 00 e0 08  5d+18:18:30.493  READ NATIVE MAX ADDRESS EXT [OBS-ACS-3]

SMART Extended Self-test Log Version: 1 (1 sectors)
Num  Test_Description    Status                  Remaining  LifeTime(hours)  LBA_of_first_error
# 1  Extended offline    Completed without error       00%     16455         -
# 2  Extended offline    Completed without error       00%     16287         -
# 3  Extended offline    Completed without error       00%     16120         -
# 4  Extended offline    Completed without error       00%     15952         -
# 5  Extended offline    Completed without error       00%     15784         -
# 6  Extended offline    Completed without error       00%     15617         -
# 7  Extended offline    Completed without error       00%     15449         -
# 8  Extended offline    Completed without error       00%     15282         -
# 9  Extended offline    Completed without error       00%     15114         -
#10  Extended offline    Completed without error       00%     14948         -
#11  Extended offline    Completed without error       00%     14781         -
#12  Extended offline    Completed without error       00%     14616         -
#13  Extended offline    Completed without error       00%     14450         -
#14  Extended offline    Completed without error       00%     14285         -
#15  Extended offline    Completed without error       00%     14117         -
#16  Extended offline    Completed without error       00%     13953         -
#17  Extended offline    Completed without error       00%     13787         -
#18  Extended offline    Completed without error       00%     13625         -

SMART Selective self-test log data structure revision number 1
 SPAN  MIN_LBA  MAX_LBA  CURRENT_TEST_STATUS
    1        0        0  Not_testing
    2        0        0  Not_testing
    3        0        0  Not_testing
    4        0        0  Not_testing
    5        0        0  Not_testing
Selective self-test flags (0x0):
  After scanning selected spans, do NOT read-scan remainder of disk.
If Selective self-test is pending on power-up, resume after 0 minute delay.

SCT Status Version:                  2
SCT Version (vendor specific):       258 (0x0102)
SCT Support Level:                   1
Device State:                        SMART Off-line Data Collection executing in background (4)
Current Temperature:                    33 Celsius
Power Cycle Min/Max Temperature:     27/34 Celsius
Lifetime    Min/Max Temperature:     32/44 Celsius
Under/Over Temperature Limit Count:   0/0

SCT Temperature History Version:     2
Temperature Sampling Period:         1 minute
Temperature Logging Interval:        1 minute
Min/Max recommended Temperature:      0/60 Celsius
Min/Max Temperature Limit:           -41/85 Celsius
Temperature History Size (Index):    128 (46)

SCT Error Recovery Control:
           Read: Disabled
          Write: Disabled

Device Statistics (GP/SMART Log 0x04) not supported

SATA Phy Event Counters (GP Log 0x11)
ID      Size     Value  Description
0x0001  2            0  Command failed due to ICRC error
0x0002  2            0  R_ERR response for data FIS
0x0003  2            0  R_ERR response for device-to-host data FIS
0x0004  2            0  R_ERR response for host-to-device data FIS
0x0005  2            0  R_ERR response for non-data FIS
0x0006  2            0  R_ERR response for device-to-host non-data FIS
0x0007  2            0  R_ERR response for host-to-device non-data FIS
0x000a  2            5  Device-to-host register FISes sent due to a COMRESET
0x8000  4       403401  Vendor specific

