=== START OF INFORMATION SECTION ===
Model Family:     Western Digital Caviar Green (AF)
Device Model:     WDC WD10EARS-00Y5B1
Serial Number:    --
LU WWN Device Id: 5 0014ee ...
Firmware Version: 80.00A80
User Capacity:    1 000 204 886 016 bytes [1,00 TB]
Sector Size:      512 bytes logical/physical
Device is:        In smartctl database [for details use: -P show]
ATA Version is:   ATA8-ACS (minor revision not indicated)
SATA Version is:  SATA 2.6, 3.0 Gb/s
Local Time is:    Sat Jul  1 23:09:36 2017 MSK
SMART support is: Available - device has SMART capability.
SMART support is: Enabled
AAM feature is:   Disabled
APM feature is:   Unavailable
Rd look-ahead is: Enabled
Write cache is:   Enabled
ATA Security is:  Disabled, frozen [SEC2]
Wt Cache Reorder: Enabled

=== START OF READ SMART DATA SECTION ===
SMART overall-health self-assessment test result: PASSED

General SMART Values:
Offline data collection status:  (0x82)	Offline data collection activity
					was completed without error.
					Auto Offline Data Collection: Enabled.
Self-test execution status:      (   0)	The previous self-test routine completed
					without error or no self-test has ever 
					been run.
Total time to complete Offline 
data collection: 		(19800) seconds.
Offline data collection
capabilities: 			 (0x7b) SMART execute Offline immediate.
					Auto Offline data collection on/off support.
					Suspend Offline collection upon new
					command.
					Offline surface scan supported.
					Self-test supported.
					Conveyance Self-test supported.
					Selective Self-test supported.
SMART capabilities:            (0x0003)	Saves SMART data before entering
					power-saving mode.
					Supports SMART auto save timer.
Error logging capability:        (0x01)	Error logging supported.
					General Purpose Logging supported.
Short self-test routine 
recommended polling time: 	 (   2) minutes.
Extended self-test routine
recommended polling time: 	 ( 228) minutes.
Conveyance self-test routine
recommended polling time: 	 (   5) minutes.
SCT capabilities: 	       (0x3031)	SCT Status supported.
					SCT Feature Control supported.
					SCT Data Table supported.

SMART Attributes Data Structure revision number: 16
Vendor Specific SMART Attributes with Thresholds:
ID# ATTRIBUTE_NAME          FLAGS    VALUE WORST THRESH FAIL RAW_VALUE
  1 Raw_Read_Error_Rate     POSR-K   200   200   051    -    0
  3 Spin_Up_Time            POS--K   134   118   021    -    6275
  4 Start_Stop_Count        -O--CK   098   098   000    -    2897
  5 Reallocated_Sector_Ct   PO--CK   200   200   140    -    0
  7 Seek_Error_Rate         -OSR-K   100   253   000    -    0
  9 Power_On_Hours          -O--CK   037   037   000    -    46321
 10 Spin_Retry_Count        -O--CK   100   100   000    -    0
 11 Calibration_Retry_Count -O--CK   100   100   000    -    0
 12 Power_Cycle_Count       -O--CK   098   098   000    -    2225
192 Power-Off_Retract_Count -O--CK   199   199   000    -    867
193 Load_Cycle_Count        -O--CK   001   001   000    -    825651
194 Temperature_Celsius     -O---K   105   093   000    -    42
196 Reallocated_Event_Count -O--CK   200   200   000    -    0
197 Current_Pending_Sector  -O--CK   200   192   000    -    10
198 Offline_Uncorrectable   ----CK   200   194   000    -    3
199 UDMA_CRC_Error_Count    -O--CK   200   200   000    -    0
200 Multi_Zone_Error_Rate   ---R--   200   178   000    -    5
                            ||||||_ K auto-keep
                            |||||__ C event count
                            ||||___ R error rate
                            |||____ S speed/performance
                            ||_____ O updated online
                            |______ P prefailure warning

General Purpose Log Directory Version 1
SMART           Log Directory Version 1 [multi-sector log support]
Address    Access  R/W   Size  Description
0x00       GPL,SL  R/O      1  Log Directory
0x01           SL  R/O      1  Summary SMART error log
0x02           SL  R/O      5  Comprehensive SMART error log
0x03       GPL     R/O      6  Ext. Comprehensive SMART error log
0x06           SL  R/O      1  SMART self-test log
0x07       GPL     R/O      1  Extended self-test log
0x09           SL  R/W      1  Selective self-test log
0x10       GPL     R/O      1  SATA NCQ Queued Error log
0x11       GPL     R/O      1  SATA Phy Event Counters log
0x80-0x9f  GPL,SL  R/W     16  Host vendor specific log
0xa0-0xa7  GPL,SL  VS      16  Device vendor specific log
0xa8-0xb7  GPL,SL  VS       1  Device vendor specific log
0xc0       GPL,SL  VS       1  Device vendor specific log
0xc1       GPL     VS      93  Device vendor specific log
0xe0       GPL,SL  R/W      1  SCT Command/Status
0xe1       GPL,SL  R/W      1  SCT Data Transfer

SMART Extended Comprehensive Error Log Version: 1 (6 sectors)
Device Error Count: 6
	CR     = Command Register
	FEATR  = Features Register
	COUNT  = Count (was: Sector Count) Register
	LBA_48 = Upper bytes of LBA High/Mid/Low Registers ]  ATA-8
	LH     = LBA High (was: Cylinder High) Register    ]   LBA
	LM     = LBA Mid (was: Cylinder Low) Register      ] Register
	LL     = LBA Low (was: Sector Number) Register     ]
	DV     = Device (was: Device/Head) Register
	DC     = Device Control Register
	ER     = Error register
	ST     = Status register
Powered_Up_Time is measured from power on, and printed as
DDd+hh:mm:SS.sss where DD=days, hh=hours, mm=minutes,
SS=sec, and sss=millisec. It "wraps" after 49.710 days.

Error 6 [5] occurred at disk power-on lifetime: 24519 hours (1021 days + 15 hours)
  When the command that caused the error occurred, the device was active or idle.

  After command completion occurred, registers were:
  ER -- ST COUNT  LBA_48  LH LM LL DV DC
  -- -- -- == -- == == == -- -- -- -- --
  40 -- 51 01 00 00 00 61 0c 7e f0 e0 00  Error: UNC 256 sectors at LBA = 0x610c7ef0 = 1628208880

  Commands leading to the command that caused the error were:
  CR FEATR COUNT  LBA_48  LH LM LL DV DC  Powered_Up_Time  Command/Feature_Name
  -- == -- == -- == == == -- -- -- -- --  ---------------  --------------------
  25 00 00 01 00 00 00 61 0c 7e f0 e0 00  5d+21:20:51.685  READ DMA EXT
  25 00 00 00 28 00 00 61 0c 7e c8 e0 00  5d+21:20:51.685  READ DMA EXT
  25 00 00 00 28 00 00 61 0c 7e a0 e0 00  5d+21:20:51.685  READ DMA EXT
  25 00 00 00 30 00 00 61 0c 7e 70 e0 00  5d+21:20:51.685  READ DMA EXT
  25 00 00 00 08 00 00 61 0c 7e 68 e0 00  5d+21:20:51.684  READ DMA EXT

Error 5 [4] occurred at disk power-on lifetime: 24427 hours (1017 days + 19 hours)
  When the command that caused the error occurred, the device was active or idle.

  After command completion occurred, registers were:
  ER -- ST COUNT  LBA_48  LH LM LL DV DC
  -- -- -- == -- == == == -- -- -- -- --
  40 -- 51 01 00 00 00 5a b3 2b 88 e0 00  Error: UNC 256 sectors at LBA = 0x5ab32b88 = 1521691528

  Commands leading to the command that caused the error were:
  CR FEATR COUNT  LBA_48  LH LM LL DV DC  Powered_Up_Time  Command/Feature_Name
  -- == -- == -- == == == -- -- -- -- --  ---------------  --------------------
  25 00 00 01 00 00 00 5a b3 2b 88 e0 00  2d+01:07:11.091  READ DMA EXT
  25 00 00 01 00 00 00 5a b3 2a 88 e0 00  2d+01:07:11.090  READ DMA EXT
  25 00 00 01 00 00 00 5a b3 29 88 e0 00  2d+01:07:11.090  READ DMA EXT
  25 00 00 01 00 00 00 5a b3 28 88 e0 00  2d+01:07:11.089  READ DMA EXT
  25 00 00 01 00 00 00 5a b3 27 88 e0 00  2d+01:07:11.089  READ DMA EXT

Error 4 [3] occurred at disk power-on lifetime: 24427 hours (1017 days + 19 hours)
  When the command that caused the error occurred, the device was active or idle.

  After command completion occurred, registers were:
  ER -- ST COUNT  LBA_48  LH LM LL DV DC
  -- -- -- == -- == == == -- -- -- -- --
  40 -- 51 01 00 00 00 5a b3 2b 88 e0 00  Error: UNC 256 sectors at LBA = 0x5ab32b88 = 1521691528

  Commands leading to the command that caused the error were:
  CR FEATR COUNT  LBA_48  LH LM LL DV DC  Powered_Up_Time  Command/Feature_Name
  -- == -- == -- == == == -- -- -- -- --  ---------------  --------------------
  25 00 00 01 00 00 00 5a b3 2b 88 e0 00  2d+01:07:05.555  READ DMA EXT
  25 00 00 01 00 00 00 5a b3 2a 88 e0 00  2d+01:07:05.553  READ DMA EXT
  25 00 00 01 00 00 00 5a b3 29 88 e0 00  2d+01:07:05.551  READ DMA EXT
  25 00 00 01 00 00 00 5a b3 28 88 e0 00  2d+01:07:05.394  READ DMA EXT
  25 00 00 01 00 00 00 5a b3 27 88 e0 00  2d+01:07:05.359  READ DMA EXT

Error 3 [2] occurred at disk power-on lifetime: 24426 hours (1017 days + 18 hours)
  When the command that caused the error occurred, the device was active or idle.

  After command completion occurred, registers were:
  ER -- ST COUNT  LBA_48  LH LM LL DV DC
  -- -- -- == -- == == == -- -- -- -- --
  40 -- 51 00 60 00 00 5a a2 78 c8 e0 00  Error: UNC 96 sectors at LBA = 0x5aa278c8 = 1520597192

  Commands leading to the command that caused the error were:
  CR FEATR COUNT  LBA_48  LH LM LL DV DC  Powered_Up_Time  Command/Feature_Name
  -- == -- == -- == == == -- -- -- -- --  ---------------  --------------------
  25 00 00 00 60 00 00 5a a2 78 c8 e0 00  2d+00:30:57.293  READ DMA EXT
  35 00 00 00 10 00 00 00 61 bd 70 e0 00  2d+00:30:57.293  WRITE DMA EXT
  25 00 00 00 58 00 00 5a a2 78 d0 e0 00  2d+00:30:54.671  READ DMA EXT
  25 00 00 00 02 00 00 5a a2 79 28 e0 00  2d+00:30:54.635  READ DMA EXT
  25 00 00 00 08 00 00 2f e9 9e c8 e0 00  2d+00:30:54.026  READ DMA EXT

Error 2 [1] occurred at disk power-on lifetime: 24426 hours (1017 days + 18 hours)
  When the command that caused the error occurred, the device was active or idle.

  After command completion occurred, registers were:
  ER -- ST COUNT  LBA_48  LH LM LL DV DC
  -- -- -- == -- == == == -- -- -- -- --
  40 -- 51 00 58 00 00 5a a2 78 d0 e0 00  Error: UNC 88 sectors at LBA = 0x5aa278d0 = 1520597200

  Commands leading to the command that caused the error were:
  CR FEATR COUNT  LBA_48  LH LM LL DV DC  Powered_Up_Time  Command/Feature_Name
  -- == -- == -- == == == -- -- -- -- --  ---------------  --------------------
  25 00 00 00 58 00 00 5a a2 78 d0 e0 00  2d+00:30:54.671  READ DMA EXT
  25 00 00 00 02 00 00 5a a2 79 28 e0 00  2d+00:30:54.635  READ DMA EXT
  25 00 00 00 08 00 00 2f e9 9e c8 e0 00  2d+00:30:54.026  READ DMA EXT
  25 00 00 00 08 00 00 2f e9 83 e0 e0 00  2d+00:30:54.024  READ DMA EXT
  25 00 00 00 08 00 00 2f e9 83 d8 e0 00  2d+00:30:54.018  READ DMA EXT

Error 1 [0] occurred at disk power-on lifetime: 24426 hours (1017 days + 18 hours)
  When the command that caused the error occurred, the device was active or idle.

  After command completion occurred, registers were:
  ER -- ST COUNT  LBA_48  LH LM LL DV DC
  -- -- -- == -- == == == -- -- -- -- --
  40 -- 51 00 5a 00 00 5a a2 78 d0 e0 00  Error: UNC 90 sectors at LBA = 0x5aa278d0 = 1520597200

  Commands leading to the command that caused the error were:
  CR FEATR COUNT  LBA_48  LH LM LL DV DC  Powered_Up_Time  Command/Feature_Name
  -- == -- == -- == == == -- -- -- -- --  ---------------  --------------------
  25 00 00 00 5a 00 00 5a a2 78 d0 e0 00  2d+00:30:49.149  READ DMA EXT
  25 00 00 00 3d 00 00 5a a0 74 68 e0 00  2d+00:30:49.139  READ DMA EXT
  25 00 00 00 36 00 00 5a 9d a3 18 e0 00  2d+00:30:49.129  READ DMA EXT
  25 00 00 00 35 00 00 5a 9b 6c 50 e0 00  2d+00:30:49.125  READ DMA EXT
  25 00 00 00 40 00 00 5a 99 36 18 e0 00  2d+00:30:49.115  READ DMA EXT

SMART Extended Self-test Log Version: 1 (1 sectors)
Num  Test_Description    Status                  Remaining  LifeTime(hours)  LBA_of_first_error
# 1  Extended offline    Completed: read failure       50%     46225         1175639912
# 2  Extended offline    Completed without error       00%     46068         -
# 3  Extended offline    Completed without error       00%     44038         -
# 4  Extended offline    Completed without error       00%     43888         -
# 5  Extended offline    Completed without error       00%     43699         -
# 6  Extended offline    Completed without error       00%     43290         -
# 7  Extended offline    Interrupted (host reset)      40%     42986         -

SMART Selective self-test log data structure revision number 1
 SPAN  MIN_LBA  MAX_LBA  CURRENT_TEST_STATUS
    1        0        0  Not_testing
    2        0        0  Not_testing
    3        0        0  Not_testing
    4        0        0  Not_testing
    5        0        0  Not_testing
Selective self-test flags (0x0):
  After scanning selected spans, do NOT read-scan remainder of disk.
If Selective self-test is pending on power-up, resume after 0 minute delay.

SCT Status Version:                  2
SCT Version (vendor specific):       258 (0x0102)
SCT Support Level:                   1
Device State:                        Active (0)
Current Temperature:                    42 Celsius
Power Cycle Min/Max Temperature:     41/46 Celsius
Lifetime    Min/Max Temperature:     42/53 Celsius
Under/Over Temperature Limit Count:   0/0

SCT Temperature History Version:     2
Temperature Sampling Period:         1 minute
Temperature Logging Interval:        1 minute
Min/Max recommended Temperature:      0/60 Celsius
Min/Max Temperature Limit:           -41/85 Celsius
Temperature History Size (Index):    478 (227)

SCT Error Recovery Control command not supported

Device Statistics (GP/SMART Log 0x04) not supported

SATA Phy Event Counters (GP Log 0x11)
ID      Size     Value  Description
0x0001  2            0  Command failed due to ICRC error
0x0002  2            0  R_ERR response for data FIS
0x0003  2            0  R_ERR response for device-to-host data FIS
0x0004  2            0  R_ERR response for host-to-device data FIS
0x0005  2            0  R_ERR response for non-data FIS
0x0006  2            0  R_ERR response for device-to-host non-data FIS
0x0007  2            0  R_ERR response for host-to-device non-data FIS
0x000a  2            2  Device-to-host register FISes sent due to a COMRESET
0x000b  2            0  CRC errors within host-to-device FIS
0x8000  4         9429  Vendor specific



